{
  "siteId": "hidden-valley-joshua-tree",
  "source": "copernicus-dem-glo-30",
  "dataset": "COP-DEM_GLO-30-DGED",
  "modelType": "DSM",
  "resolutionM": 30,
  "resolutionArcSeconds": 1,
  "verticalDatum": "EGM2008",
  "requestedPoint": [
    34.0124,
    -116.168
  ],
  "tile": "N34_00_W117_00",
  "sourceObject": "s3://copernicus-dem-30m/Copernicus_DSM_COG_10_N34_00_W117_00_DEM/Copernicus_DSM_COG_10_N34_00_W117_00_DEM.tif",
  "publicFallback": true,
  "elevationM": 1285.677,
  "neighborhoods": [
    {
      "radiusKm": 0.25,
      "elevationM": 1286.396,
      "validSampleCount": 242
    },
    {
      "radiusKm": 1,
      "elevationM": 1275.734,
      "validSampleCount": 3964
    }
  ],
  "noDataPolicy": "masked-or-nodata-values-excluded",
  "coverage": 1,
  "warnings": [],
  "retrievedAt": "2026-09-01T01:23:02.417426Z"
}
