{
  "siteId": "collowara-tourist-observatory",
  "source": "copernicus-dem-glo-30",
  "dataset": "COP-DEM_GLO-30-DGED",
  "modelType": "DSM",
  "resolutionM": 30,
  "resolutionArcSeconds": 1,
  "verticalDatum": "EGM2008",
  "requestedPoint": [
    -30.241,
    -71.065
  ],
  "tile": "S31_00_W072_00",
  "sourceObject": "s3://copernicus-dem-30m/Copernicus_DSM_COG_10_S31_00_W072_00_DEM/Copernicus_DSM_COG_10_S31_00_W072_00_DEM.tif",
  "publicFallback": true,
  "elevationM": 1095.47,
  "neighborhoods": [
    {
      "radiusKm": 0.25,
      "elevationM": 1090.452,
      "validSampleCount": 236
    },
    {
      "radiusKm": 1,
      "elevationM": 1072.982,
      "validSampleCount": 3806
    }
  ],
  "noDataPolicy": "masked-or-nodata-values-excluded",
  "coverage": 1,
  "warnings": [],
  "retrievedAt": "2026-08-26T20:44:59.069215Z"
}
